score,date,content,writer_id,like_count,dislike_count,source
10,2026.05.31 22:31,불쾌한 꿈을 꾼 뒤의 기분을 정확히 재현했다,ryiy****,2,0,네티즌
10,2026.05.31 21:42,원작의 시각적 고증은 정말 완벽하더라고요. 단순한 인터넷 괴담을 스크린으로 이 정도 깊이까지 확장한 연출력은 정말 대단한 것 같습니다. 이스터에그 찾는 재미도 쏠쏠했고요,wlrt****,2,0,네티즌
8,2026.05.31 21:42,"촬영기법 및 영상미가 돋보이며, 배경음에서 오는 긴장감이 매우 인상적! 다만, 전개가 다소 빠르다보니 중간에 나오는 공간이나 장면에 의미가 있는 트랙이 곳곳에 잘 녹아져 있음. 따라서 화면이 확확 전개될 때마다 인물의 심리나 상징성을 바로바로 확인하고, 느껴야 하는 부분이 있음. 그래서 아무 생각없이 보면 너무 지루할 수 있음(그만큼 생각을 해야하는 부분이 많음)",chul****,2,0,네티즌
6,2026.05.31 16:39,감독이 예술병걸려서공포 장르라는 특성을 망각한 듯스토리 진행될수록 개연성 없어지고 걍 웃김,forg****,2,0,네티즌
10,2026.05.30 19:37,"점프 스케어 없이 사람 숨통을 조이는 역대급 미스터리 스릴러맨날 왁! 하고 소리 지르며 깜짝 놀라게 하는 뻔한 공포영화에 지쳤다면 이 영화가 정답이다. 고어물처럼 피 한 방울 튀기지 않는데도, 사람 정신을 완전히 피말리게 만드는 기묘한 압박감이 압권이다.",59ki****,2,0,네티즌
10,2026.05.30 19:33,역대급 영화 너무 재미있어요,jang****,2,0,네티즌
6,2026.05.30 18:56,좋지도 나쁘지도 않은 스토리와 연출이었습니다무언갈 많이 담고 싶은 느낌이라 가볍게 느껴지기도 했습니다.주의할 점은 주말 오후6-7시 전에는 가지마세요.초등학생분들 진짜 뛰어다닙니다.15세로 알고있는데 딱히 제제도 없어서 난리납니다.,naze****,2,0,네티즌
10,2026.05.29 23:41,너무 무서웠어요 여름영화로 딱인듯 ㅋㅋ재밌게 봤습니다,jmyo****,2,0,네티즌
9,2026.05.29 23:40,참신하긴 한데 아무래도 대중적인 재미보다는 매니아층 저격용 영화인 듯 ㅠㅠ,yqmk****,2,0,네티즌
10,2026.05.29 23:40,너무 무서워용 근데 재밌었습니다!,hhwa****,2,0,네티즌
10,2026.05.29 23:39,"영화 백룸은 화려한 공포보다 음산한 분위기와 심리적인 불안감을 강조한 작품이다. 끝없이 이어지는 복도와 형광등 소음이 답답한 공포를 만들며, 관객까지 길을 잃은 듯한 느낌을 준다. 스토리는 다소 난해할 수 있지만, 설명되지 않는 공간이 주는 기묘한 분위기가 오래 기억에 남는 영화였다.",kyou****,2,0,네티즌
6,2026.05.29 23:16,아… 내가 아는 백룸은 이런게 아닌데….아니 20대에 이런 상상하는건 좀 대단하긴한데 오히려 뭔가 괴물이 달라져서 문제가 된 느낌?그리고 영화 장면들을 보면 청불이 딱 맞는 느낌임.그리고 이해가 안가는 부분이 많고 뭐를 전하려는지 알기 어려움… 뭔가 단편영화보다 더 끔찍한 느낌 원래 괴물이 딱 맞는듯 너무 심오한 스토리임.오히려 백룸의 이미지가 더 흑화된 느낌임. 그리고 소음이 너무 심하고 관람평에 갑툭튀 없다고 한 어느 댓글 때문에 영화 끝나고 팝콘 줍고있는 꼬라지 됐습니다^^,thet****,2,0,네티즌
9,2026.05.29 20:59,오랜만에 오싹하니 잘 봤네용 ㅋㅋㅋ,wnbc****,2,0,네티즌
10,2026.05.29 18:36,"스릴러물이지만 세련되었고,그 세계관을 이해하면 더더욱 빠져든다.곧 꺼져버릴것같은 옛날 깜빡이는 형광등을 보면,또 그런 소리가 들리면 생각이 많아질것같다.",bana****,2,0,네티즌
10,2026.05.29 17:35,공포영화보다 미스터리 장르를 좋아하는 편인데 이 작품은 공간 자체를 이야기로 활용한 점이 인상적이었다. 독특한 경험.,7una****,2,0,네티즌
10,2026.05.29 17:33,아들이 보고 싶다고 해서 같이 봤는데 예상보다 잘 만들었네요. 요즘 공포영화 중에서는 신선한 편이었습니다.,psez****,2,0,네티즌
10,2026.05.29 17:32,공포를 소리 지르게 만드는 방식이 아니라 천천히 스며들게 만든다. 이런 연출은 꽤 오랜만에 본 것 같다.,pp0h****,2,0,네티즌
10,2026.05.29 14:37,간만에 재미난 영화 봤네요.호불호가 있을수가 있으나 저는 참 재미났어요,alan****,2,0,네티즌
10,2026.05.29 14:37,게임은 무서우면 끄면되지...극장 탈출구...없더.. 강제격리... 손에땀나 죽는줄 ㅠㅠㅠㅠ,wjss****,2,0,네티즌
10,2026.05.29 14:36,백룸 관련 유튜브만 보다가 영화보니까 재밌네요,srin****,2,0,네티즌
10,2026.05.29 14:36,"처음부터 끝까지 몰입해서 본 영화입니다. 스토리와 연출, 배우들의 연기가 모두 훌륭했고 여운이 오래 남았습니다. 꼭 한 번 보시길 추천합니다!",jo-o****,2,0,네티즌
10,2026.05.29 14:35,일단 뻔하디 뻔한 공포영화에 좀 벗어나고싶다 나는 색다른 공포를 원한다 하시는분들 적극 추천입니다 솔직히 기대는 안하고 봤는데 남편이랑 둘이 봤는데 둘다 손에 땀철철;;;말그대로 나도 영화관에 갖힌 기분이랄까....찝찝하면서 중독됨 ㅜㅜㅜ 공포영화좀 봤다 하시는분들은 꼭 영화관에서 상영추천합니다,wldu****,2,0,네티즌
10,2026.05.29 14:35,현실과 비현실의 경계가 흐려지는 분위기가 정말 압도적이었어요 단순한 공포보다도 알 수 없는 공간에서 오는 불안감이 오래 남는 작품인거같아요조용한 연출인데도 긴장감이 계속 이어져서 몰입해서 봤네요,park****,2,0,네티즌
9,2026.05.29 13:54,긴장감 때문에 팝콘 먹는 것도 까먹고 봤다..,jdlj****,2,0,네티즌
10,2026.05.29 13:52,진짜 오랜만에 심장 쫄리면서 봤음 와.. 진짜 후덜덜,khs5****,2,0,네티즌
10,2026.05.29 13:51,배우들 연기 미첫슴돠 너무 재밋게봣어요 강추!!!,jsm0****,2,0,네티즌
10,2026.05.29 13:46,ㅜㅜㅜㅜ무서워요ㅠㅠㅠ근데 재밌어요 공포 영화 좋아하시는 분들께 추천드려요! 스토리도 연기도 좋았습니다,dmsw****,2,0,네티즌
10,2026.05.29 13:41,오랜만에 제가 좋이하는 장르와 분위기의 영화라정말 재밌게 봣구요 단어는 생각이안나지만 비바리움처럼 뭔가 불편한?느낌이 드는 초현실적인 공포영화였어요 !,evan****,2,0,네티즌
8,2026.05.29 12:52,전체적으로 영상미가 꽤 괜찮아서 보는 재미도 있었다. 색감이랑 카메라 연출이 영화 분위기랑 잘 어울림 ㅎㄷㄷ,wsfy****,2,0,네티즌
9,2026.05.29 12:19,공간 자체가 주는 공포감이 엄청 큼 폐쇄된 장소에서 오는 답답함이 진짜 현실적으로 느껴짐,opeg****,2,0,네티즌
10,2026.05.29 11:40,솔직히 큰 기대 없이 봤는데 생각보다 분위기 연출이 너무 좋아서 끝까지 엄청 몰입하면서 봤다. 단순히 갑툭튀로 놀래키는 스타일이 아니라 점점 사람 심리 압박하는 느낌이라 더 무서웠음..,zich****,2,0,네티즌
10,2026.05.29 11:08,재밌게 봤네요 대만족입니다~,szrz****,2,0,네티즌
10,2026.05.29 10:29,흔한 공포영화 클리셰에 질렸다면 이 영화 추천!,cesw****,2,0,네티즌
10,2026.05.29 10:17,나 당분간 이케아 못가겠다노란벽 나올까봐 무섭네,mh98****,2,0,네티즌
10,2026.05.29 10:14,유튜브에서 보던걸 영화로 제대로 보니 더 재밌음연출 잘했다 사운드때문에 더 심장 쫄깃,fu40****,2,0,네티즌
10,2026.05.29 01:11,‘왜 무서운지 설명하기 어려운 공포’를 정말 잘 구현한 영화였다. 그냥 화면만 보고 있어도 불쾌하고 불안해지는 느낌이 계속 든다,fqsg****,2,0,네티즌
10,2026.05.29 00:12,늘보던 공포영화가 아닌 심리적으로 압박감있는분위기의 영화라 더 무섭고 공포로 다가온 영화였음,dlsh****,2,0,네티즌
10,2026.05.29 00:03,스포 당하기 전에 얼른 보러옴,cdmz****,2,0,네티즌
10,2026.05.29 00:01,공포영화 잘 못 보는데 이건 피 튀기는 거 없어서 볼 만했음. 대신 정신적으로 힘듦,tget****,2,0,네티즌
9,2026.05.28 23:50,기존 공포영화 클리셰가 적어서 신선,ajcd****,2,0,네티즌
10,2026.05.28 23:47,중간중간 나오는 소음 연출이 진짜 미쳤다.,wvoz****,2,0,네티즌
10,2026.05.28 23:26,아 진짜 무서워여어어 무사워서 뛰쳐나가고 싶었어요 ㅠㅠㅠ허흑,oiuy****,2,0,네티즌
10,2026.05.28 23:23,안보신 분들은 무조건 보세요.,jian****,2,0,네티즌
9,2026.05.28 23:15,무한 공간 설정을 정말 잘 살렸다,egyr****,2,0,네티즌
10,2026.05.28 23:02,백룸 원작 감성 구현은 거의 완벽했다.,tict****,2,0,네티즌
9,2026.05.28 23:00,추천 추천 굿굿 굿 ㅋㅋㅋ,mefy****,2,0,네티즌
10,2026.05.28 22:58,"사운드 디자인이 진짜 미쳤다. 형광등 웅웅거리는 소리, 멀리서 들리는 이상한 발소리, 텅 빈 공간의 울림 같은 것들이 영화 분위기를 완성한다. 헤드폰이나 좋은 음향관에서 보면 훨씬 무섭다.",elaz****,2,0,네티즌
9,2026.05.28 22:40,조용한 장면이 더 무서웠다;;;,olys****,2,0,네티즌
10,2026.05.28 22:38,백룸 원작 특유의 “현실에서 살짝 어긋난 공간” 느낌을 정말 잘 살렸다. 어디선가 본 것 같은 장소인데 동시에 너무 비현실적이라 계속 기분이 이상해진다. 영화관에서 보면 몰입감이 엄청나다.,lmci****,2,0,네티즌
9,2026.05.28 22:36,설명을 최소화한 연출 방식이.. 오히려 영화의 매력을 살렸다. 관객이 직접 상상하게 만드는 부분이 많다..,cwoo****,2,0,네티즌
10,2026.05.28 22:33,개인적으로 점프스케어 남발 안 해서 좋았음 분위기로 조지는 스타일~,zsmy****,2,0,네티즌
10,2026.05.28 22:32,기대없이봐서 그런가 재밌게 봤습니다 ㅎㅎ,zvyr****,2,0,네티즌
10,2026.05.28 22:28,기대한거보다 훨씬 재미있어요!,asxy****,2,0,네티즌
10,2026.05.28 20:44,최고의 방탈출 영화 공포와 스릴이 장난아님,tjda****,2,0,네티즌
8,2026.05.28 20:42,연출도 마무리도 백룸스러워서 좋았네요,rjsq****,2,0,네티즌
10,2026.05.28 20:27,배우들에 연기 하나하나가 너무 인상 깊었어요 그래서 영황에 더욱 집중 해서 볼 수 있었어요.,kimj****,2,0,네티즌
10,2026.05.28 20:27,제 인생 영화 탑 3 안에 듭니다너무 재밌어서 강력 추천!!,wlgh****,2,0,네티즌
8,2026.05.28 20:21,유튜브로만 보다가 실제 영화로 나왔데서 봤더니 생각보다 무섭고 재밌었습니다,dong****,2,0,네티즌
10,2026.05.28 19:43,올해 본 공포영화 중에서는 제일 독특했던 것 같음. 취향 맞으면 진짜 좋아할 스타일.,ffkz****,2,0,네티즌
10,2026.05.28 19:41,내용이 너무 좋고 보는 내내 몰입감 있네요,taew****,2,0,네티즌
10,2026.05.28 18:57,몰입도 최고인 영화입니다.,ring****,2,0,네티즌
10,2026.05.28 18:21,기대 안 하고 봤는데 너무 재밌었어요! 꼭 보세요!,dleh****,2,0,네티즌
10,2026.05.28 18:19,진짜 너무 재미있었어요!! 또 보고싶어지는 영화인거 같아요,wdy3****,2,0,네티즌
10,2026.05.28 18:19,"그냥 마냥 공포가 아닌, 심오한 이야기가 담긴. 역시 미드소마 제작사 A24다.바이포엠이 이걸 배급해준 게 고마울 뿐~",euns****,2,0,네티즌
10,2026.05.28 18:14,"올해 본 영화 중 가장 숨 막히게 몰입한 작품이었다. 시작부터 끝까지 긴장감을 미친 듯이 끌고 가는데, 단 한 장면도 눈을 뗄 수 없을 정도다. 어두운 분위기와 압박감 넘치는 연출이 엄청나게 강렬하고, 배우들 연기는 진짜 현실 같아서 보는 내내 소름이 돋는다. 단순히 자극적이기만 한 영화가 아니라 인간 심리를 끝까지 파고드는 느낌이라 보고 나서도 계속 생각난다. 특히 후반부 전개는 충격적이면서도 압도적이라 영화관 분위기 자체가 얼어붙는 느낌이었다. 웬만한 스릴러 영화보다 훨씬 강렬하고, 오래 기억에 남을 작품이다.",2602****,2,0,네티즌
10,2026.05.28 13:31,분위기랑 공간 연출이 진짜 독특하고 몰입감 있다.. 갠적으로 은근하게 소름 돋는 스타일이라 여운이 오래 남는 영화.,ju02****,2,0,네티즌
10,2026.05.27 22:25,여운이 미쳤다.그래서 내용이 뭔데.개를 본적이 없는데 어떻게 설명해,sang****,2,0,네티즌
10,2026.05.27 22:25,진짜 내스타일의 영화예고편 보고 바로 이영화다 싶었음너무 무섭고 스토리 탄탄팝콘도 다 남기고옴,rlaa****,2,0,네티즌
9,2026.05.27 22:14,"백룸을 2019년도부터 쭉 봐왔던 사람인데요 (백룸을 많이 좋아해요),일단 좀 아쉬운 것도 있긴 했는데 전체적으로 너무 잘 만들었고 무조건 봐보세요. 적극추천합니다 !!!",abcd****,2,0,네티즌
10,2026.05.27 21:32,몰입감 장난 아니었고 공간이 주는 공포감도 너무 좋았습니다… 사운드도 좋았어요,pos0****,2,0,네티즌
10,2026.05.27 21:00,재밌는 영화 랜만이라 너무 설렜어요 방탈출 좋아하는 분들한테 완전 추천해요 흔한 내용이 아니라 너무 좋았어요!!,hess****,2,0,네티즌
10,2026.05.27 20:52,영화자체가 거대한 홍대병,wnst****,2,0,네티즌
10,2026.05.27 20:24,"세계관을 알면 진짜,재밋는 영화에요킬링타임으로 굿굿올만에 잼게봤어요",andc****,2,0,네티즌
10,2026.05.27 20:22,감독 천재인듯 원작고증완벽ㄷㄷ지립니다  내가 갇힌 느낌 .어떨지 걱정했는데 고증제대로 했네요,euny****,2,0,네티즌
10,2026.06.22 22:22,관람평 호불호 갈리는거 보고 망설였는데.  진심 정말 재밌게봤네요. 결말까지 완전 몰입해서 봤습니다.   분위기나 색감이나 연출. 완전 최고였습니다.  그런데 백룸에대한 어느정도 알고있는 사람과 전혀 모르고 본 사람과는 확실히 호불호 차이가 납니다.,luna****,3,1,네티즌
10,2026.06.19 00:23,"감독은 누구보다 친절하고, 공포스럽고, 모던하게 백룸을 실재화한다. 다만 그것도 이해하지 못한 몇몇 우매한 민중이 있을 뿐이다.",zero****,3,1,네티즌
